Timestamp,Program Studi ,Semester,Seberapa sering Anda menggunakan tools AI (Artificial Intelligence) untuk keperluan Kuliah?  ,  Tools AI apa yang paling sering Anda gunakan?  ,Untuk tujuan apa Anda paling sering menggunakan AI? (Pilih maksimal 3),Apakah menurut Anda pihak Kampus/Program Studi perlu mengeluarkan regulasi resmi atau batasan yang jelas mengenai penggunaan AI dalam tugas kuliah?  ,Apakah Anda merasa pihak kampus perlu mengadakan sosialisasi atau pelatihan tentang cara menggunakan AI secara bijak dan etis?,Harapan atau saran Anda terkait penggunaan teknologi AI dalam ekosistem perkuliahan ke depannya:  ,Menurut anda apakah AI membantu meningkatkan pemahaman terhadap materi?,Menurut anda apa manfaat utama AI dalam pembelajaran? Jawab secara singkat!,Tantangan apa yang menghambat anda dalam menggunakan AI?,Menurut anda apakah kampus perlu membuat regulasi terkait penggunaan AI dalam pembelajaran?,Apakah perlu diadakan pelatihan peggunaan AI yang bijak?
22/06/2026 12:17:05,Akuntansi ,Semester 2,Jarang (Hanya saat terdesak),ChatGPT,"Membantu menjelaskan materi kuliah yang sulit dipahami, Membantu menulis/memperbaiki tata bahasa (Termasuk Tugas Kuliah, dll)","Perlu, tetapi hanya sebagai panduan (bukan larangan ketat).","Ya, sangat butuh agar mahasiswa tahu batasan etisnya",Gunakan ai secara bijak dan bertanggung jawab bagi mahasiswanya ataupun dosen,Ya,Manfaatnya dapat mempercepat mencari informasi yang kita butuhkan dan membantu juga dalam memahami materi ,Informasi kurang akurat,Perlu,Setuju
22/06/2026 12:37:44,Manajemen ,Semester 2,Kadang-kadang (Saat ada tugas Kuliah),ChatGPT,Membantu menjelaskan materi kuliah yang sulit dipahami,"Ya, sangat perlu agar tidak terjadi kecurangan.",Cukup disisipkan saja saat  atau kuliah umum.,Untuk tujuan/hal yang sehat saja seperti menambah pengetahuan dan pemahaman terkait poin pelajaran yang kurang dimengerti ,Ya,Memperjelas dengan cara yang lebih lugas dan sebagai perbandingan untuk cara kedepannya dalam memahami materi yang disampaikan ,Menjadi ketergantungan terhadap AI,Perlu,Setuju
22/06/2026 12:39:48,Informatika ,Semester 2,Sering (Hampir Setiap Hari),ChatGPT,"Mencari ide/inspirasi topik tugas, Membantu menjelaskan materi kuliah yang sulit dipahami, Membantu menulis/memperbaiki tata bahasa (Termasuk Tugas Kuliah, dll)","Ya, sangat perlu agar tidak terjadi kecurangan.",Cukup disisipkan saja saat  atau kuliah umum.,lebih dijelaskan lagi tentang penggunaan ai,Ya,membantu membuat kalimat yg lebih baik,Informasi kurang akurat,Perlu,Setuju
22/06/2026 13:20:52,D3 Akuntansi,Semester 2,Kadang-kadang (Saat ada tugas Kuliah),Gemini AI,"Mencari ide/inspirasi topik tugas, Membantu menjelaskan materi kuliah yang sulit dipahami, Membantu menulis/memperbaiki tata bahasa (Termasuk Tugas Kuliah, dll)","Perlu, tetapi hanya sebagai panduan (bukan larangan ketat).",Cukup disisipkan saja saat  atau kuliah umum.,Harapannya adalah dengan adanya AI bisa membantu memahami materi dan mengerjakan tugas kuliah menjadi lebih cepat. ,Ya,Membantu meringkas atau menjelaskan materi dengan lebih baik. ,Menjadi ketergantungan terhadap AI,Perlu,Setuju
28/06/2026 20:36:30,Informatika,Semester 2,Kadang-kadang (Saat ada tugas Kuliah),Gemini AI,"Membantu menulis/memperbaiki tata bahasa (Termasuk Tugas Kuliah, dll)","Perlu, tetapi hanya sebagai panduan (bukan larangan ketat).","Tidak perlu, mahasiswa bisa belajar sendiri secara otodidak",meningkat,Ya,membantu,Menjadi ketergantungan terhadap AI,Tidak perlu,Setuju